{
  "contract": "otc.mobile.table/1.0",
  "request_id": "req_read_empty",
  "table_uri": "https://example.invalid/table/123",
  "mode": "base",
  "source_revision": "sha256:source-empty",
  "fields": [{"id": "status", "label": "Status", "type": "string", "nullable": true, "editable": true, "read_only_reason": null}],
  "rows": [],
  "next_page_token": null
}
