{
  "contract": "otc.mobile.table/1.0",
  "request_id": "req_read_first",
  "table_uri": "https://example.invalid/table/123",
  "mode": "base",
  "source_revision": "sha256:source-base",
  "fields": [
    {"id": "status", "label": "Status", "type": "string", "nullable": true, "editable": true, "read_only_reason": null},
    {"id": "count", "label": "Count", "type": "integer", "nullable": false, "editable": true, "read_only_reason": null},
    {"id": "enabled", "label": "Enabled", "type": "boolean", "nullable": false, "editable": true, "read_only_reason": null},
    {"id": "code", "label": "Code", "type": "string", "nullable": true, "editable": true, "read_only_reason": null}
  ],
  "rows": [
    {"record_id": "rec_123", "record_revision": "sha256:record-123", "values": {"status": "Open", "count": 0, "enabled": false, "code": "0012"}},
    {"record_id": "rec_124", "record_revision": "sha256:record-124", "values": {"status": null, "count": 4, "enabled": true, "code": ""}}
  ],
  "next_page_token": "opaque.cursor/2"
}
